[
  {
    "id": "acme-tools",
    "name": "ACME Tools",
    "tier": "main",
    "website": "https://www.acme-tools.example",
    "logo": "images/sponsors/acme-tools.webp",
    "since": "2024",
    "blurb": "Leading provider of precision darts equipment."
  },
  {
    "id": "spark-energy",
    "name": "Spark Energy",
    "tier": "shirt",
    "website": "https://www.spark-energy.example",
    "logo": "images/sponsors/spark-energy.webp",
    "since": "2025"
  }
]
